<?xml version="1.0" encoding="UTF-8"?>
<xs:schema xmlns:xs="http://www.w3.org/2001/XMLSchema">

	<xs:element name="reisi">
		<xs:complexType>
			<xs:sequence>
				<xs:element name="reis" maxOccurs="unbounded">
					<xs:complexType>
						<xs:sequence>
							<xs:element name="city">
								<xs:complexType>
									<xs:sequence>
										<xs:element name="street" type="xs:string"/>
									</xs:sequence>
									<xs:attribute name="city" type="xs:string" use="required"/>
								</xs:complexType>
							</xs:element>
							<xs:element name="currency" type="xs:string"/>
							<xs:element name="transport" type="xs:string"/>
							<xs:element name="transport_cost" type="xs:decimal"/>
							<xs:element name="accommodation" type="xs:decimal"/>
							<xs:element name="excursions" type="xs:decimal"/>
							<xs:element name="rating" type="xs:decimal"/>
						</xs:sequence>
						<xs:attribute name="airport" type="xs:string" use="required"/>
						<xs:attribute name="airline" type="xs:string" use="required"/>
						<xs:attribute name="number" type="xs:string" use="required"/>
					</xs:complexType>
				</xs:element>
			</xs:sequence>
		</xs:complexType>
	</xs:element>

</xs:schema>
